[
  {
    "extraction_id": "EXT-2299",
    "parser_mapping_schema_version": "1.0.0",
    "extracted_value": "Day 1",
    "normalized_value": "Day 1",
    "target_schema": "Protocol_Visit_Definition",
    "target_field": "visit_label",
    "confidence_score": 0.8,
    "source_page": "6",
    "source_table": "PROTOCOL_A012_t2",
    "source_text_evidence": "Day 1",
    "extraction_method": "pdf_text",
    "reviewer_status": "pending"
  },
  {
    "extraction_id": "EXT-8228",
    "parser_mapping_schema_version": "1.0.0",
    "extracted_value": "Study Time Point",
    "normalized_value": "Study Time",
    "target_schema": "Protocol_Procedure_Definition",
    "target_field": "procedure_name",
    "confidence_score": 0.9,
    "source_page": "6",
    "source_table": "PROTOCOL_A012_t2",
    "source_text_evidence": "Study Time Point",
    "extraction_method": "pdf_text",
    "reviewer_status": "pending"
  },
  {
    "extraction_id": "EXT-2242",
    "parser_mapping_schema_version": "1.0.0",
    "extracted_value": "",
    "normalized_value": "",
    "target_schema": "Protocol_Procedure_Definition",
    "target_field": "procedure_name",
    "confidence_score": 0.9,
    "source_page": "6",
    "source_table": "PROTOCOL_A012_t2",
    "source_text_evidence": "",
    "extraction_method": "pdf_text",
    "reviewer_status": "pending"
  },
  {
    "extraction_id": "EXT-8586",
    "parser_mapping_schema_version": "1.0.0",
    "extracted_value": "Type of Visit",
    "normalized_value": "Type of",
    "target_schema": "Protocol_Procedure_Definition",
    "target_field": "procedure_name",
    "confidence_score": 0.9,
    "source_page": "6",
    "source_table": "PROTOCOL_A012_t2",
    "source_text_evidence": "Type of Visit",
    "extraction_method": "pdf_text",
    "reviewer_status": "pending"
  },
  {
    "extraction_id": "EXT-4885",
    "parser_mapping_schema_version": "1.0.0",
    "extracted_value": "Window Allowance (-/+ Days)",
    "normalized_value": "Window Allowance (-/+ Days)",
    "target_schema": "Protocol_Procedure_Definition",
    "target_field": "procedure_name",
    "confidence_score": 0.9,
    "source_page": "6",
    "source_table": "PROTOCOL_A012_t2",
    "source_text_evidence": "Window Allowance (-/+ Days)",
    "extraction_method": "pdf_text",
    "reviewer_status": "pending"
  },
  {
    "extraction_id": "EXT-3415",
    "parser_mapping_schema_version": "1.0.0",
    "extracted_value": "",
    "normalized_value": "",
    "target_schema": "Protocol_Procedure_Definition",
    "target_field": "procedure_name",
    "confidence_score": 0.9,
    "source_page": "6",
    "source_table": "PROTOCOL_A012_t2",
    "source_text_evidence": "",
    "extraction_method": "pdf_text",
    "reviewer_status": "pending"
  },
  {
    "extraction_id": "EXT-5806",
    "parser_mapping_schema_version": "1.0.0",
    "extracted_value": "Screening Procedures \u2022 Informed consent \u2022 Blood draw: CMV [INVESTIGATIONAL_PRODUCT_A]/IgM, CBC, AST, ALT, HIV 1/2 antibody \u2022 Urine pregnancy test \u2022 Inclusion/exclusion criteria \u2022 Medical history/Con Meds",
    "normalized_value": "Screening Procedures \u2022 Informed consent \u2022 Blood draw: CMV [INVESTIGATIONAL_PRODUCT_A]/IgM, CBC, AST, ALT, HIV 1/2 antibody \u2022 Urine pregnancy test \u2022 Inclusion/exclusion criteria \u2022 Medical history/Con",
    "target_schema": "Protocol_Procedure_Definition",
    "target_field": "procedure_name",
    "confidence_score": 0.9,
    "source_page": "6",
    "source_table": "PROTOCOL_A012_t2",
    "source_text_evidence": "Screening Procedures \u2022 Informed consent \u2022 Blood draw: CMV [INVESTIGATIONAL_PRODUCT_A]/IgM, CBC, AST, ALT, HIV 1/2 antibody \u2022 Urine pregnancy test \u2022 Inclusion/exclusion criteria \u2022 Medical history/Con Meds",
    "extraction_method": "pdf_text",
    "reviewer_status": "pending"
  },
  {
    "extraction_id": "EXT-2660",
    "parser_mapping_schema_version": "1.0.0",
    "extracted_value": "Day 1 Procedures \u2022 Demographic data \u2022 Baseline vital signs and physical exam \u2022 Randomization",
    "normalized_value": "Day 1 Procedures \u2022 Demographic data \u2022 Baseline vital signs and physical exam \u2022",
    "target_schema": "Protocol_Procedure_Definition",
    "target_field": "procedure_name",
    "confidence_score": 0.9,
    "source_page": "6",
    "source_table": "PROTOCOL_A012_t2",
    "source_text_evidence": "Day 1 Procedures \u2022 Demographic data \u2022 Baseline vital signs and physical exam \u2022 Randomization",
    "extraction_method": "pdf_text",
    "reviewer_status": "pending"
  },
  {
    "extraction_id": "EXT-2850",
    "parser_mapping_schema_version": "1.0.0",
    "extracted_value": "Day 1, Month 2, and Month 6 Vaccination Procedures \u2022 Confirm eligibility \u2022 Urine pregnancy test \u2022 Administer vaccination \u2022 60-minute post-vaccination assessment \u2022 Training on Diary Card completion and distribution of Diary Card",
    "normalized_value": "Day 1, Month 2, and Month 6 Vaccination Procedures \u2022 Confirm eligibility \u2022 Urine pregnancy test \u2022 Administer vaccination \u2022 60-minute post-vaccination assessment \u2022 Training on Diary Card completion and distribution of Diary",
    "target_schema": "Protocol_Procedure_Definition",
    "target_field": "procedure_name",
    "confidence_score": 0.9,
    "source_page": "6",
    "source_table": "PROTOCOL_A012_t2",
    "source_text_evidence": "Day 1, Month 2, and Month 6 Vaccination Procedures \u2022 Confirm eligibility \u2022 Urine pregnancy test \u2022 Administer vaccination \u2022 60-minute post-vaccination assessment \u2022 Training on Diary Card completion and distribution of Diary Card",
    "extraction_method": "pdf_text",
    "reviewer_status": "pending"
  },
  {
    "extraction_id": "EXT-2724",
    "parser_mapping_schema_version": "1.0.0",
    "extracted_value": "Blood draw: Immunogenicity",
    "normalized_value": "Blood draw:",
    "target_schema": "Protocol_Procedure_Definition",
    "target_field": "procedure_name",
    "confidence_score": 0.9,
    "source_page": "6",
    "source_table": "PROTOCOL_A012_t2",
    "source_text_evidence": "Blood draw: Immunogenicity",
    "extraction_method": "pdf_text",
    "reviewer_status": "pending"
  },
  {
    "extraction_id": "EXT-3117",
    "parser_mapping_schema_version": "1.0.0",
    "extracted_value": "Blood draw: Seroconversion",
    "normalized_value": "Blood draw:",
    "target_schema": "Protocol_Procedure_Definition",
    "target_field": "procedure_name",
    "confidence_score": 0.9,
    "source_page": "6",
    "source_table": "PROTOCOL_A012_t2",
    "source_text_evidence": "Blood draw: Seroconversion",
    "extraction_method": "pdf_text",
    "reviewer_status": "pending"
  }
]