[
  {
    "extraction_id": "EXT-1142",
    "parser_mapping_schema_version": "1.0.0",
    "extracted_value": "Visit Number",
    "normalized_value": "Visit Number",
    "target_schema": "Protocol_Visit_Definition",
    "target_field": "visit_label",
    "confidence_score": 0.8,
    "source_page": "18",
    "source_table": "PROTOCOL_A004_AMEND_002_t2",
    "source_text_evidence": "Visit Number",
    "extraction_method": "pdf_text",
    "reviewer_status": "pending"
  },
  {
    "extraction_id": "EXT-2791",
    "parser_mapping_schema_version": "1.0.0",
    "extracted_value": "Visit Number",
    "normalized_value": "Visit Number",
    "target_schema": "Protocol_Visit_Definition",
    "target_field": "visit_label",
    "confidence_score": 0.8,
    "source_page": "20",
    "source_table": "PROTOCOL_A004_AMEND_002_t4",
    "source_text_evidence": "Visit Number",
    "extraction_method": "pdf_text",
    "reviewer_status": "pending"
  },
  {
    "extraction_id": "EXT-1002",
    "parser_mapping_schema_version": "1.0.0",
    "extracted_value": "Visit Number",
    "normalized_value": "Visit Number",
    "target_schema": "Protocol_Visit_Definition",
    "target_field": "visit_label",
    "confidence_score": 0.8,
    "source_page": "22",
    "source_table": "PROTOCOL_A004_AMEND_002_t6",
    "source_text_evidence": "Visit Number",
    "extraction_method": "pdf_text",
    "reviewer_status": "pending"
  },
  {
    "extraction_id": "EXT-2904",
    "parser_mapping_schema_version": "1.0.0",
    "extracted_value": "Visit Number",
    "normalized_value": "Visit Number",
    "target_schema": "Protocol_Visit_Definition",
    "target_field": "visit_label",
    "confidence_score": 0.8,
    "source_page": "23",
    "source_table": "PROTOCOL_A004_AMEND_002_t7",
    "source_text_evidence": "Visit Number",
    "extraction_method": "pdf_text",
    "reviewer_status": "pending"
  },
  {
    "extraction_id": "EXT-2875",
    "parser_mapping_schema_version": "1.0.0",
    "extracted_value": "Visit Number",
    "normalized_value": "Visit Number",
    "target_schema": "Protocol_Visit_Definition",
    "target_field": "visit_label",
    "confidence_score": 0.8,
    "source_page": "24",
    "source_table": "PROTOCOL_A004_AMEND_002_t8",
    "source_text_evidence": "Visit Number",
    "extraction_method": "pdf_text",
    "reviewer_status": "pending"
  },
  {
    "extraction_id": "EXT-9609",
    "parser_mapping_schema_version": "1.0.0",
    "extracted_value": "Visit Number",
    "normalized_value": "Visit Number",
    "target_schema": "Protocol_Visit_Definition",
    "target_field": "visit_label",
    "confidence_score": 0.8,
    "source_page": "26",
    "source_table": "PROTOCOL_A004_AMEND_002_t10",
    "source_text_evidence": "Visit Number",
    "extraction_method": "pdf_text",
    "reviewer_status": "pending"
  }
]